[
  {
    "id": "spot-001",
    "slug": "yungang-grottoes",
    "nameZh": "云冈石窟",
    "nameEn": "Yungang Grottoes",
    "cityZh": "大同市",
    "cityEn": "Datong",
    "level": {
      "zh": "世界文化遗产（2001）；国家5A级旅游景区；全国重点文物保护单位。5A状态应在上线前用文化和旅游主管部门最新名录复核。",
      "en": "UNESCO World Heritage Site (2001), national 5A tourist attraction, and a Major Historical and Cultural Site Protected at the National Level. Recheck the latest 5A register before production release.",
      "verification": "heritage verified; current rating list should be rechecked"
    },
    "tags": [
      {
        "zh": "石窟",
        "en": "Grottoes"
      },
      {
        "zh": "佛教艺术",
        "en": "Buddhist Art"
      },
      {
        "zh": "北魏",
        "en": "Northern Wei"
      },
      {
        "zh": "世界遗产",
        "en": "World Heritage"
      },
      {
        "zh": "雕塑",
        "en": "Sculpture"
      }
    ],
    "summaryZh": "云冈石窟位于大同西郊，是中国早期佛教石窟艺术的重要代表。数百座洞窟与数万尊造像集中展示了5至6世纪佛教艺术由中亚、南亚传播并在中国本土化的过程，昙曜五窟尤具代表性。",
    "summaryEn": "Located west of Datong, the Yungang Grottoes are a landmark of early Chinese Buddhist cave art. Hundreds of caves and tens of thousands of figures reveal how artistic ideas from South and Central Asia were transformed in China during the fifth and sixth centuries. The Tanyao Five Caves form the best-known core of the site.",
    "introZh": "云冈石窟开凿于北魏时期，是理解大同作为北魏都城以及佛教艺术跨区域传播的关键遗产。联合国教科文组织资料记载，这里保存有252座洞窟和约5.1万尊造像。大型佛像、窟内浮雕、装饰纹样与建筑式样共同反映了不同文化传统的交流与重构。参观时不应只关注“最大的佛像”，还可以观察造像服饰、面部风格和洞窟布局如何随年代变化。由于石雕长期受到风化、水汽和游客环境影响，现场常按洞窟实施开放、拍摄和客流管理。小程序应把历史解读、保护原因和当日开放提示放在同一页面。",
    "introEn": "Carved during the Northern Wei period, Yungang is essential for understanding Datong’s role as an imperial capital and the cross-regional movement of Buddhist art. UNESCO records 252 caves and about 51,000 statues. Monumental Buddhas, reliefs, decorative patterns and architectural motifs show how multiple artistic traditions were exchanged and reinterpreted. Visitors should look beyond the largest statues and notice how clothing, facial styles and cave layouts change across periods. Because the sandstone is vulnerable to weathering, moisture and visitor impact, individual caves may have photography, access or crowd restrictions. The app should present historical meaning, conservation reasons and same-day access information together.",
    "highlights": [
      {
        "zh": "昙曜五窟：云冈早期大型洞窟的核心代表。",
        "en": "Tanyao Five Caves: the defining group of Yungang’s early monumental caves."
      },
      {
        "zh": "第20窟露天大佛：云冈最具辨识度的视觉形象之一。",
        "en": "The open-air Buddha of Cave 20: one of Yungang’s most recognizable images."
      },
      {
        "zh": "造像风格变化：可观察外来艺术因素与中国传统逐步融合。",
        "en": "Changing sculptural styles: trace the gradual fusion of imported and Chinese artistic traditions."
      },
      {
        "zh": "云冈博物馆与数字展示：适合补充洞窟保护和考古知识。",
        "en": "Museum and digital interpretation: useful for understanding archaeology and conservation."
      }
    ],
    "openTimeZh": "UNVERIFIED：通常按日间开放并区分季节，停止入园时间早于闭园时间；部分洞窟可能轮换或临时关闭。以下为演示用典型公开信息，开放时间、票价、预约、交通管制和可进入区域可能临时调整，请以景区当日官方公告及现场指引为准。",
    "openTimeEn": "UNVERIFIED: The site normally operates during daytime with seasonal schedules, and last admission is earlier than closing time. Individual caves may rotate or close temporarily. The following is typical public information for demonstration purposes. Opening hours, prices, reservation rules, traffic controls and accessible areas may change. Check the attraction’s official same-day notice and on-site instructions before visiting.",
    "ticketZh": "UNVERIFIED：实行收费参观，常见成人票价区间约为人民币100～150元；可能使用实名预约，优惠政策和讲解服务另行计算。以下为演示用典型公开信息，开放时间、票价、预约、交通管制和可进入区域可能临时调整，请以景区当日官方公告及现场指引为准。",
    "ticketEn": "UNVERIFIED: Paid admission is required; a typical adult range is approximately RMB 100–150. Real-name booking may be used, and concessions or guide services may follow separate rules. The following is typical public information for demonstration purposes. Opening hours, prices, reservation rules, traffic controls and accessible areas may change. Check the attraction’s official same-day notice and on-site instructions before visiting.",
    "transportZh": "可先到大同南站或大同云冈机场，再通过市内公交、出租车或网约车前往大同西部的景区。返程时应提前确认公交末班时间；跨城一日游建议预留安检、取票和步行时间。",
    "transportEn": "Reach Datong via Datong South Railway Station or Datong Yungang Airport, then continue west by city bus, taxi or ride-hailing service. Check the last public bus in advance and allow time for security checks, ticket verification and walking.",
    "bestSeasonZh": "春秋温度较舒适；大同冬季寒冷、风大，夏季日照较强。洞窟参观以室内和半室外为主，但景区步行距离仍需考虑。",
    "bestSeasonEn": "Spring and autumn are generally comfortable. Datong winters are cold and windy, while summer sunlight can be strong. Much of the visit is inside or near caves, but the site still involves substantial outdoor walking.",
    "visitTipsZh": "禁止触摸造像和岩壁；是否允许拍照以每个洞窟入口标识为准，默认关闭闪光灯。热门洞窟可能排队和限时停留。英文讲解器、人工讲解和无障碍路线应在游客中心再次确认。",
    "visitTipsEn": "Do not touch statues or rock surfaces. Follow the sign at each cave for photography and keep flash off by default. Popular caves may require queuing and limited viewing time. Reconfirm English audio guides, staffed tours and accessible routes at the visitor center.",
    "culturalNotes": [
      {
        "barrierType": "barrier-historical-context",
        "titleZh": "为什么云冈具有国际意义",
        "titleEn": "Why Yungang Matters Internationally",
        "bodyZh": "云冈不是孤立的地方艺术，而是佛教图像、帝国政治和丝路交流在中国北方汇合的结果。",
        "bodyEn": "Yungang is not an isolated local style; it reflects the meeting of Buddhist imagery, imperial power and Silk Road exchange in northern China.",
        "doZh": "比较不同洞窟的服饰、面容和装饰。",
        "doEn": "Compare clothing, facial styles and ornament across caves.",
        "dontZh": "不要只用“古老”和“巨大”概括其价值。",
        "dontEn": "Do not reduce its significance to age and size alone."
      },
      {
        "barrierType": "barrier-heritage-protection",
        "titleZh": "洞窟内拍摄与保护",
        "titleEn": "Photography and Conservation Inside Caves",
        "bodyZh": "光线、拥堵和触摸都会增加脆弱石雕与彩绘的保护压力。",
        "bodyEn": "Light, crowding and touching add pressure to fragile stone and surviving pigments.",
        "doZh": "逐窟查看标识，关闭闪光灯并快速通过狭窄区域。",
        "doEn": "Check each cave sign, keep flash off and move efficiently through narrow spaces.",
        "dontZh": "不要触摸、倚靠岩壁或为拍照阻塞通道。",
        "dontEn": "Do not touch or lean on rock surfaces, or block passages for photographs."
      },
      {
        "barrierType": "barrier-crowd-queue",
        "titleZh": "热门洞窟排队",
        "titleEn": "Queues at Popular Caves",
        "bodyZh": "核心洞窟在节假日可能限流，排队位置与开放状态会动态变化。",
        "bodyEn": "Core caves may use capacity limits on busy days, and queue locations or access can change.",
        "doZh": "优先查看当日开放清单并错峰参观。",
        "doEn": "Check the day’s cave-access list and visit outside peak periods.",
        "dontZh": "不要离队插入狭窄队列。",
        "dontEn": "Do not leave and re-enter a narrow queue by cutting in."
      }
    ],
    "services": [
      "svc-ticket-passport",
      "svc-ticket-reservation",
      "svc-rule-photo",
      "svc-rule-touch",
      "spot-svc-yungang-photo",
      "spot-svc-yungang-route",
      "spot-svc-yungang-guide"
    ],
    "geo": {
      "lat": 40.10972,
      "lng": 113.12222,
      "precision": "UNESCO property coordinate; visitor entrance may differ"
    },
    "coverImageHint": {
      "zh": "选择能同时看到第20窟露天大佛、岩壁洞窟序列与游客尺度的横幅图。检索词：云冈石窟 第20窟 全景、Yungang Grottoes Cave 20 panorama。",
      "en": "Use a wide image showing the open-air Buddha of Cave 20, the line of cliff caves and human scale. Search: “Yungang Grottoes Cave 20 panorama”.",
      "discoveryUrls": [
        "https://whc.unesco.org/en/list/1039/gallery/",
        "https://commons.wikimedia.org/wiki/Category:Yungang_Grottoes"
      ],
      "licenseNote": "Check the license and attribution requirements for each image before reuse."
    },
    "sources": [
      "https://whc.unesco.org/en/list/1039/",
      "https://www.yungang.org/",
      "https://www.ncha.gov.cn/",
      "https://www.dt.gov.cn/"
    ]
  },
  {
    "id": "spot-002",
    "slug": "mount-wutai",
    "nameZh": "五台山",
    "nameEn": "Mount Wutai",
    "cityZh": "忻州市",
    "cityEn": "Xinzhou",
    "level": {
      "zh": "世界文化遗产（2009）；国家5A级旅游景区；国家级风景名胜区。当前门票及车辆预约政策需上线前复核。",
      "en": "UNESCO World Heritage Site (2009), national 5A tourist attraction and national scenic area. Current ticket and vehicle-booking rules require pre-release verification.",
      "verification": "heritage verified; dynamic access rules unverified"
    },
    "tags": [
      {
        "zh": "佛教圣地",
        "en": "Buddhist Sacred Site"
      },
      {
        "zh": "文化景观",
        "en": "Cultural Landscape"
      },
      {
        "zh": "寺院群",
        "en": "Monastery Complex"
      },
      {
        "zh": "山地",
        "en": "Mountain"
      },
      {
        "zh": "世界遗产",
        "en": "World Heritage"
      }
    ],
    "summaryZh": "五台山由五座台顶及台怀镇寺院群构成，是文殊信仰的重要中心，也是汉传与藏传佛教传统共同存在的文化景观。这里既是宗教目的地，也是高海拔山地景区，参观需要同时考虑礼仪、气候和交通。",
    "summaryEn": "Mount Wutai is a cultural landscape formed by five broad summits and a major monastic center around Taihuai. It is closely associated with devotion to Manjusri and includes both Chinese and Tibetan Buddhist traditions. Visitors need to consider religious etiquette, mountain weather and local transport together.",
    "introZh": "五台山不是单一山峰，而是一组环绕台怀盆地的山地与寺院。联合国教科文组织将其价值概括为佛教建筑、宗教传统与自然地形长期互动形成的文化景观。显通寺、塔院寺、菩萨顶、殊像寺等集中在台怀镇周边，佛光寺则以唐代木构建筑闻名，但与核心游览区距离较远。外国游客应理解，寺院既是文化遗产，也是仍在使用的宗教空间。部分殿堂会举行法会或日常修持，参观行为应服从现场秩序。景区海拔较高，天气变化快，冬季和肩季可能出现冰雪、低温及道路交通管制，因此小程序应把礼仪卡、天气预警、接驳交通和寺院开放状态联动展示。",